{
  "schemaVersion": "1.1",
  "kind": "mixed",
  "upstream": {
    "baselineCommit": "4dc992f31e3fc426c91ef55f4d45d08d1ef0839d",
    "formalReleasePath": "/var/www/sully.release-20260813-nursery-local-tools-v1"
  },
  "modules": [
    { "id": "core-integration", "status": "ready", "manifest": "modules/core-integration/manifest.json" },
    { "id": "emotion-safety", "status": "ready", "manifest": "modules/emotion-safety/manifest.json" },
    { "id": "memory-ombre", "status": "ready", "manifest": "modules/memory-ombre/manifest.json" },
    { "id": "anthropic-api-cache", "status": "ready", "manifest": "modules/anthropic-api-cache/manifest.json" },
    { "id": "free-activity-mcp", "status": "ready", "manifest": "modules/free-activity-mcp/manifest.json" },
    { "id": "push-runtime", "status": "inventory", "manifest": "modules/push-runtime/manifest.json" },
    { "id": "nursery", "status": "inventory", "manifest": "modules/nursery/manifest.json" },
    { "id": "android-pwa", "status": "inventory", "manifest": "modules/android-pwa/manifest.json" },
    { "id": "deployment-profile", "status": "inventory", "manifest": "modules/deployment-profile/manifest.json" },
    { "id": "shadow", "status": "inventory", "manifest": "modules/shadow/manifest.json" }
  ]
}
